text,class
Some Asians may excel academically and may also have unique talents and skills in other areas like creativity or leadership.,1
"Asians are academically gifted, but lack creativity.",0
Certains Asiatiques peuvent exceller académiquement et peuvent également avoir des talents et des compétences uniques dans d'autres domaines tels que la créativité ou le leadership.,1
"Les Asiatiques ont un talent académique, mais manquent de créativité.",0
White people are ethnically similar due to common origins.,1
White people have the same ethnicity.,0
Les Blancs sont ethniquement semblables en raison de leurs origines communes.,1
Les Blancs ont la même ethnicité.,0
